{
  "schema_version": "independent_source_review_supplement.v5",
  "reviewer_id": "night-v6-reviewer-b-source-only-fallback-workhorse",
  "source_packet_path": "research/customer-benchmark/semantic-v6-peer-extension/blind-source-2f52b35f12d7.json",
  "source_packet_raw_sha256": "84dda0e5cda28c532bbbd2e73a7c4c2c6643ad2aefe16752a2ff979dfc8207cd",
  "records": [
    {
      "example_id": "e-5c9ecc9b10da06ce3c98f246",
      "source_record_json_sha256": "33719ffee4b9b0ccef519c0d50ce3d3d3cd36ffbebbc93349d448bd181a90613",
      "source_input_json_sha256": "b817354218fd193620dd9d9bc26bc24b79b751bd43bffbb750f9bb5e4e50da5c",
      "source_record_path": "/records/0",
      "primary_label": "negative",
      "primary_observed": true,
      "privacy_surface_eligible": true,
      "privacy_reason": "Independently inspected utterance contains generic product/conversation language and, where present, non-identifying emotional self-description; no name, contact/account identifier, authentication secret or real transaction credential is exposed. Eligibility is a synthetic source-surface judgment, not bank policy.",
      "date_candidates": [],
      "evidence_spans": [
        {
          "raw_field_path": "/records/0/input/utterance/text",
          "offset_unit": "python_unicode_codepoints",
          "char_start": 0,
          "char_end": 94,
          "text": "That figure has made my stomach drop. What is included in the card balance you just mentioned?",
          "utf8_byte_start": 0,
          "utf8_byte_end": 94
        }
      ],
      "rationale": "A generic emotional reaction introduces a request to explain what the card balance includes."
    },
    {
      "example_id": "e-c73113fe0fba7d1e9954ab29",
      "source_record_json_sha256": "e5bed6bebc39eaded33267504ea9ef0ff08853ffa29b6f796f784f0493365c56",
      "source_input_json_sha256": "c6695365a612c65fefdbcb47dc5ef48ed092d1784818234a9c2c66083bd42c22",
      "source_record_path": "/records/1",
      "primary_label": "negative",
      "primary_observed": true,
      "privacy_surface_eligible": true,
      "privacy_reason": "Independently inspected utterance contains generic product/conversation language and, where present, non-identifying emotional self-description; no name, contact/account identifier, authentication secret or real transaction credential is exposed. Eligibility is a synthetic source-surface judgment, not bank policy.",
      "date_candidates": [],
      "evidence_spans": [
        {
          "raw_field_path": "/records/1/input/utterance/text",
          "offset_unit": "python_unicode_codepoints",
          "char_start": 0,
          "char_end": 126,
          "text": "I’m trying to keep calm; when you say the card balance, are you describing the whole balance or only the part being discussed?",
          "utf8_byte_start": 0,
          "utf8_byte_end": 128
        }
      ],
      "rationale": "The speaker asks whether card balance means the whole balance or only the discussed part."
    },
    {
      "example_id": "e-5dcbdeb471193ec64f16518a",
      "source_record_json_sha256": "39035965d1c39be6df960b815c11ac1e13ecab51849ee4894848ec19fa78d093",
      "source_input_json_sha256": "c395d222809328579709d82b707a5153b0e2d5fab11439a9719916a203beb965",
      "source_record_path": "/records/2",
      "primary_label": "negative",
      "primary_observed": true,
      "privacy_surface_eligible": true,
      "privacy_reason": "Independently inspected utterance contains generic product/conversation language and, where present, non-identifying emotional self-description; no name, contact/account identifier, authentication secret or real transaction credential is exposed. Eligibility is a synthetic source-surface judgment, not bank policy.",
      "date_candidates": [
        {
          "source_span": {
            "raw_field_path": "/records/2/input/utterance/text",
            "offset_unit": "python_unicode_codepoints",
            "char_start": 0,
            "char_end": 15,
            "text": "Before I answer",
            "utf8_byte_start": 0,
            "utf8_byte_end": 15
          },
          "candidate_role": "uncertain",
          "presence": "ambiguous",
          "completion": "complete",
          "completion_observed": true,
          "target_indices": [],
          "target_scope_observed": false,
          "maximal_boundary_observed": true,
          "polarity": "asserted",
          "reference_status": "unassessed",
          "normalization_status": "not_assessed",
          "rationale": "Explicit conversational temporal surface retained conservatively: 'Before I answer'. Its grammatical temporal phrase is complete, but it may describe a pause, response ordering, simultaneity or discourse time rather than a DATE-slot value. DATE applicability and payment-target mapping remain unassessed; an empty target array is not a finding of target absence. No current calendar or normalized payment term is supplied."
        }
      ],
      "evidence_spans": [
        {
          "raw_field_path": "/records/2/input/utterance/text",
          "offset_unit": "python_unicode_codepoints",
          "char_start": 0,
          "char_end": 115,
          "text": "Before I answer, could you unpack what the card figure is made up of? I can't tell which part you are asking about.",
          "utf8_byte_start": 0,
          "utf8_byte_end": 115
        }
      ],
      "rationale": "The speaker requests an explanation of the card figure before answering."
    },
    {
      "example_id": "e-7954c6d434856b89c0a380ee",
      "source_record_json_sha256": "d3b0c84c3c35e598ab4f2ccf13c113e31afafa17bde736f6a50e63b3426078d7",
      "source_input_json_sha256": "447f876ba47d1fc573cd849f98791f976d8b83b62d7ed61f9ce96ca8ca5d45a7",
      "source_record_path": "/records/3",
      "primary_label": "negative",
      "primary_observed": true,
      "privacy_surface_eligible": true,
      "privacy_reason": "Independently inspected utterance contains generic product/conversation language and, where present, non-identifying emotional self-description; no name, contact/account identifier, authentication secret or real transaction credential is exposed. Eligibility is a synthetic source-surface judgment, not bank policy.",
      "date_candidates": [
        {
          "source_span": {
            "raw_field_path": "/records/3/input/utterance/text",
            "offset_unit": "python_unicode_codepoints",
            "char_start": 21,
            "char_end": 28,
            "text": "at once",
            "utf8_byte_start": 21,
            "utf8_byte_end": 28
          },
          "candidate_role": "uncertain",
          "presence": "ambiguous",
          "completion": "complete",
          "completion_observed": true,
          "target_indices": [],
          "target_scope_observed": false,
          "maximal_boundary_observed": true,
          "polarity": "asserted",
          "reference_status": "unassessed",
          "normalization_status": "not_assessed",
          "rationale": "Explicit conversational temporal surface retained conservatively: 'at once'. Its grammatical temporal phrase is complete, but it may describe a pause, response ordering, simultaneity or discourse time rather than a DATE-slot value. DATE applicability and payment-target mapping remain unassessed; an empty target array is not a finding of target absence. No current calendar or normalized payment term is supplied."
        }
      ],
      "evidence_spans": [
        {
          "raw_field_path": "/records/3/input/utterance/text",
          "offset_unit": "python_unicode_codepoints",
          "char_start": 0,
          "char_end": 113,
          "text": "Both figures arrived at once and I lost the thread. Could you repeat the card figure, then the instalment figure?",
          "utf8_byte_start": 0,
          "utf8_byte_end": 113
        }
      ],
      "rationale": "The dominant act requests repetition of both product figures."
    },
    {
      "example_id": "e-2607364b56a6a189d547426b",
      "source_record_json_sha256": "df49b1029a32d0a3762811daf0abfbeb0300d0a76f6f9bd8c34d22a3faff2e38",
      "source_input_json_sha256": "13bcbadfecd735dbaae144c28370e05ef1c7eb771d38d4b35d63e0e5d0b9af2f",
      "source_record_path": "/records/4",
      "primary_label": "negative",
      "primary_observed": true,
      "privacy_surface_eligible": true,
      "privacy_reason": "Independently inspected utterance contains generic product/conversation language and, where present, non-identifying emotional self-description; no name, contact/account identifier, authentication secret or real transaction credential is exposed. Eligibility is a synthetic source-surface judgment, not bank policy.",
      "date_candidates": [],
      "evidence_spans": [
        {
          "raw_field_path": "/records/4/input/utterance/text",
          "offset_unit": "python_unicode_codepoints",
          "char_start": 0,
          "char_end": 92,
          "text": "Please say those two amounts again with a breath between them; I only caught the second one.",
          "utf8_byte_start": 0,
          "utf8_byte_end": 92
        }
      ],
      "rationale": "The speaker asks for a paced repetition of two amounts."
    },
    {
      "example_id": "e-7577db56f5dbfd0a142b4ac6",
      "source_record_json_sha256": "7d759923e8ac8847d8b190d12dc7038f8030186278385a6f6d58a29200adc8a5",
      "source_input_json_sha256": "29ea4296d4ccce21323436dc138da9634575eb618c84c187d09cb5b43973ac84",
      "source_record_path": "/records/5",
      "primary_label": "negative",
      "primary_observed": true,
      "privacy_surface_eligible": true,